{
  "$schema": "https://json-schema.org/draft/2020-12/schema",
  "$id": "https://github.com/Egoushka/whetstone/schemas/export/v1/export.schema.json",
  "title": "export/v1",
  "description": "One line of `whetstone export`: one stored enhance call and what feedback reported for it. The prompt and every context field are already redacted; the rewrite is not kept.",
  "type": "object",
  "required": ["request_id", "created_at", "prompt", "truncated", "context", "answer", "outcome"],
  "additionalProperties": false,
  "properties": {
    "request_id": { "type": "string", "minLength": 1 },
    "created_at": { "type": "string", "format": "date-time", "description": "UTC, when enhance answered." },
    "prompt": { "type": "string", "description": "The prompt as sent, secrets replaced by [REDACTED:kind], cut at 32,000 characters." },
    "truncated": { "type": "boolean", "description": "True when the prompt was cut." },
    "hand_label": { "type": "boolean", "description": "The owner's verdict from whetstone label: the run completed without needing a re-ask. Left out when unlabelled." },
    "context": {
      "type": "object",
      "description": "What the client sent beside the prompt; a field it did not send is left out.",
      "additionalProperties": false,
      "properties": {
        "repository": { "type": "string" },
        "commit": { "type": "string" },
        "task_kind": { "type": "string" },
        "client": { "type": "string" },
        "session_id": { "type": "string", "description": "The client's opaque session id; an import stores a hash of the transcript's session id." },
        "ablation": { "type": "string", "description": "What the client held out for the session (rule:<id>, skill:<name>@<version>)." }
      }
    },
    "answer": {
      "type": "object",
      "required": ["changed", "template_id", "template_version", "held_out"],
      "additionalProperties": false,
      "properties": {
        "changed": { "type": "boolean" },
        "template_id": { "type": ["string", "null"] },
        "template_version": { "type": ["string", "null"] },
        "held_out": { "type": "boolean" },
        "source_request_id": { "type": "string", "minLength": 1, "description": "The stored request a retrieval drew on; left out when there was none." },
        "arm": { "enum": ["champion", "challenger", "held_out"], "description": "The arm of a template trial the request was given; left out when no trial applied." },
        "traits": { "type": "object", "additionalProperties": { "type": "boolean" }, "description": "Each trait of the kind drawn for the request: true when its paragraph was added. Left out when the kind has no traits or the request was held out." }
      }
    },
    "outcome": {
      "description": "Null until the client reports through feedback; then what it reported. The first five fields are null when the client did not know; the run and reward measures (completed to person_ms) are left out when not reported.",
      "oneOf": [
        { "type": "null" },
        {
          "type": "object",
          "required": ["reported_at"],
          "additionalProperties": false,
          "properties": {
            "rewrite_accepted": { "type": ["boolean", "null"] },
            "model_overridden": { "type": ["boolean", "null"] },
            "score": { "type": ["number", "null"], "minimum": 0, "maximum": 1 },
            "cost_usd": { "type": ["number", "null"], "minimum": 0 },
            "model": { "type": ["string", "null"] },
            "completed": { "type": "boolean" },
            "tokens_in": { "type": "integer", "minimum": 0 },
            "tokens_out": { "type": "integer", "minimum": 0 },
            "cache_read_tokens": { "type": "integer", "minimum": 0 },
            "cache_write_tokens": { "type": "integer", "minimum": 0 },
            "duration_ms": { "type": "integer", "minimum": 0 },
            "tool_calls": { "type": "integer", "minimum": 0 },
            "asked_again": { "type": "boolean" },
            "effort": { "type": "string" },
            "commits": { "type": "integer", "minimum": 0 },
            "pr_merged": { "type": "boolean" },
            "ci_first_push_green": { "type": "boolean" },
            "reverted": { "type": "boolean" },
            "item_closed": { "type": "boolean" },
            "correction_reason": { "enum": ["wrong_target", "incomplete", "wrong_approach", "misread", "too_much", "style", "new_info", "stop", "other"] },
            "review_findings": { "type": "integer", "minimum": 0 },
            "review_findings_severe": { "type": "integer", "minimum": 0 },
            "person_ms": { "type": "integer", "minimum": 0 },
            "rewritten_prompt": { "type": "string", "description": "What the client's model wrote in place of the prompt, redacted; with the request's prompt it is a rewrite pair, and rewrite_accepted says whether the person sent it." },
            "reported_at": { "type": "string", "format": "date-time" }
          }
        }
      ]
    }
  }
}
