{ "request_id": "req-0004", "created_at": "2026-10-19T09:00:00.0000000Z", "prompt": "add a retry to the upload client and open a pull request", "truncated": false, "hand_label": true, "context": { "repository": "example/app", "task_kind": "typed/implement", "client": "claude-code", "session_id": "s-7f3a", "ablation": "rule:stop-rule" }, "answer": { "changed": true, "template_id": "typed-brief", "template_version": "1", "held_out": false, "arm": "champion" }, "outcome": { "rewrite_accepted": true, "model_overridden": null, "score": null, "cost_usd": null, "model": "provider/model-a", "completed": true, "asked_again": true, "commits": 3, "pr_merged": true, "ci_first_push_green": false, "reverted": false, "item_closed": true, "correction_reason": "incomplete", "review_findings": 2, "review_findings_severe": 0, "person_ms": 95000, "reported_at": "2026-10-20T09:00:00.0000000Z" } }
