{"request_id": "req-0007", "created_at": "2026-10-05T12:00:00.0000000Z", "prompt": "review my diff; the failing header was Authorization: [REDACTED:header]", "truncated": false, "context": {"repository": "example/app", "commit": "abc1234", "task_kind": "review", "client": "chargehand"}, "answer": {"changed": true, "template_id": "tpl-review", "template_version": "1.2.0", "held_out": false, "source_request_id": "req-0002"}, "outcome": {"rewrite_accepted": true, "model_overridden": false, "score": 0.9, "cost_usd": 0.04, "model": "provider/model-a", "reported_at": "2026-10-05T12:09:41.0000000Z"}}