{"request_id": "req-0005", "created_at": "2026-10-19T09:00:00.0000000Z", "prompt": "add retry to upload client", "truncated": false, "context": {"repository": "example/app", "task_kind": "typed/implement", "client": "claude-code", "session_id": "s-7f3a"}, "answer": {"changed": true, "template_id": "typed-brief", "template_version": "1", "held_out": false, "arm": "champion"}, "outcome": {"rewrite_accepted": false, "model_overridden": null, "score": null, "cost_usd": null, "model": "provider/model-a", "reported_at": "2026-10-19T09:05:00.0000000Z", "rewritten_prompt": "Add a retry with backoff to the upload client; keep the existing timeout."}}
