{ "request_id": "req-0003", "created_at": "2026-10-05T12:00:00.0000000Z", "prompt": "list the files that define the retry policy", "truncated": false, "context": { "task_kind": "agent/explore", "client": "claude-code/agent" }, "answer": { "changed": false, "template_id": null, "template_version": null, "held_out": true }, "outcome": { "rewrite_accepted": null, "model_overridden": null, "score": null, "cost_usd": null, "model": "provider/model-a", "completed": true, "tokens_in": 1840, "tokens_out": 612, "cache_read_tokens": 41200, "cache_write_tokens": 3100, "duration_ms": 48250, "tool_calls": 14, "asked_again": false, "effort": "medium", "reported_at": "2026-10-05T12:09:41.0000000Z" } }
