{ "request_id": "req-0006", "created_at": "2026-10-19T12:00:00.0000000Z", "prompt": "add a retry to the upload client", "truncated": false, "context": { "task_kind": "typed/implement", "client": "claude-code" }, "answer": { "changed": true, "template_id": "typed-brief", "template_version": "1", "held_out": false, "arm": "champion", "traits": { "name-the-file": true, "stop-rule": false } }, "outcome": null }
