{ "request_id": "req-0004", "created_at": "2026-10-05T13:00:00.0000000Z", "prompt": "explain this module\n[CUT]", "truncated": true, "context": { "task_kind": "explain" }, "answer": { "changed": false, "template_id": null, "template_version": null, "held_out": true }, "outcome": { "rewrite_accepted": null, "model_overridden": null, "score": 0.5, "cost_usd": null, "model": null, "reported_at": "2026-10-05T13:05:00.0000000Z" } }
